{
  "coverage": {
    "branch_pct": 71.43,
    "line_pct": 88.24
  },
  "duplication": {
    "pct": 1.20
  },
  "files": {
    "src/api/handler.ts": {
      "complexity": null,
      "loc": 312,
      "violations": 3
    },
    "src/utils/format.ts": {
      "complexity": null,
      "loc": 48,
      "violations": 1
    }
  },
  "language": "bunjs",
  "root": "/path/to/project",
  "tools_missing": [],
  "tools_used": [
    "biome",
    "bun",
    "jscpd"
  ],
  "violations": {
    "errors": 0,
    "info": 0,
    "warnings": 4
  },
  "vulnerabilities": {
    "critical": 0,
    "high": 0,
    "low": 0,
    "medium": 0
  }
}
